<?xml version="1.0" encoding="UTF-8"?>
<users xmlns="http://www.uts.edu.au/31284/wsd"
          xmlns:xsi="http://www.w3.org/2001/XMLSchema-instance"
          xsi:schemaLocation="http://www.uts.edu.au/31284/wsd users.xsd">
    <user>
        <id>1</id>
        <name>Ryan</name>
        <email>234@gmail.com</email>
        <password>12345</password>
        <date_of_birth>1958-05-09</date_of_birth>
        <speciality>WSD</speciality>
        <status>available</status>
    </user>
</users>